id,decision_id,created_at,updated_at,ticker,position_type,thesis_statement,conviction,pillars,catalysts,risks,update_log,target_price,stop_loss,valuation_methodology,entry_price,entry_date,status,closed_at,close_reason
1,,2026-03-03 23:11:55.77863+00,2026-03-03 23:11:55.788993+00,TEST,LONG,Test thesis for verification,HIGH,"""[{\""id\"": 1, \""description\"": \""Revenue growth > 15%\"", \""trend\"": \""IMPROVING\"", \""current_status\"": \""Q1 was 18%\"", \""last_updated\"": \""2026-03-03\""}]""","""[]""","""[]""","""[{\""date\"": \""2026-03-03T23:11:55.782360+00:00\"", \""data_point\"": \""Q1 revenue beat by 5%\"", \""thesis_impact\"": \""CONFIRMS\"", \""action\"": \""MAINTAIN\"", \""conviction_change\"": null}]""",,,,10,2026-03-03,exited,2026-03-03 23:11:55.788993+00,Test complete
8,,2026-04-09 14:00:47.82329+00,2026-05-21 16:04:40.263856+00,AENT,LONG,"AENT is a high-quality physical media distributor with 90%+ insider ownership, generating ~$60M run-rate EBITDA at ~6x EV/EBITDA, benefiting from exclusive Paramount distribution rights and structural tailwinds in vinyl and collectibles.",MEDIUM,"""[{\""name\"": \""Structural Growth Tailwinds\"", \""description\"": \""Vinyl resurgence (22% CAGR since 2019) and collectibles market expansion provide secular growth drivers\""}]""","""[{\""name\"": \""Q2 2026 Earnings\"", \""description\"": \""Q2 2026 earnings (May 21, 42 days away) expected to show continued margin expansion and revenue growth\"", \""date\"": \""2026-05-21\""}, {\""name\"": \""Paramount Distribution Expansion\"", \""description\"": \""Potential expansion of distribution rights to streaming content or new product categories\""}, {\""name\"": \""Price Dip Entry\"", \""description\"": \""Current $6.98 price represents 1.4% dip from entry price, providing additional margin of safety\"", \""date\"": \""2026-04-14\"", \""impact\"": \""Medium\""}]""","""[{\""name\"": \""Digital Disruption\"", \""description\"": \""Accelerated shift to streaming could pressure physical media volumes\""}, {\""name\"": \""Paramount Contract Renewal\"", \""description\"": \""Key distribution agreement expires in 2027; renewal risk\""}, {\""name\"": \""Inventory Management\"", \""description\"": \""Physical media requires significant working capital and inventory management\""}]""","[""[\""[{\\\""date\\\"": \\\""2026-04-09T14:00:59.564033+00:00\\\"", \\\""data_point\\\"": \\\""Q2 2026 financials show $368.7M revenue, $17.1M operating income, $9.4M net income, $18.4M EBITDA. Strong cash flow generation with $61.5M operating cash flow in Q2 2026, confirming durable business model.\\\"", \\\""thesis_impact\\\"": \\\""CONFIRMS\\\"", \\\""action\\\"": \\\""MAINTAIN\\\"", \\\""conviction_change\\\"": \\\""MEDIUM-HIGH\\\""}, {\\\""date\\\"": \\\""2026-04-10T14:01:01.349627+00:00\\\"", \\\""data_point\\\"": \\\""Q2 FY2026 financials confirm $368.7M revenue and $9.4M net income, supporting $60M+ annualized EBITDA run-rate\\\"", \\\""thesis_impact\\\"": \\\""CONFIRMS\\\"", \\\""action\\\"": \\\""MAINTAIN\\\"", \\\""conviction_change\\\"": \\\""HIGH\\\""}, {\\\""date\\\"": \\\""2026-04-14T14:01:26.593054+00:00\\\"", \\\""data_point\\\"": \\\""Trade executed 26 shares at $7.08 with Kelly sizing. Current price $6.98 represents 1.4% dip from entry.\\\"", \\\""thesis_impact\\\"": \\\""CONFIRMS\\\"", \\\""action\\\"": \\\""MAINTAIN\\\"", \\\""conviction_change\\\"": \\\""HIGH\\\""}]\"", {\""at\"": \""2026-05-19T14:03:07.403342+00:00\"", \""action\"": \""trim\"", \""reasoning\"": \""Trimming for concentration risk management. AENT represents 12.2% of portfolio value, above target position size of ~12.5%. While the LONG thesis remains valid with stop-loss at $5.95 and target at $9.00, the position is overweight and underperforming, making it appropriate to reduce exposure to improve portfolio allocation.\""}, {\""date\"": \""2026-05-21T16:03:03.496378+00:00\"", \""data_point\"": \""Current price $6.13 approaching stop-loss $5.95, portfolio underperformance -11.26% alpha, minimal cash position 2.3% limiting tactical deployment\"", \""thesis_impact\"": \""WEAKENS\"", \""action\"": \""MAINTAIN\"", \""conviction_change\"": \""MEDIUM\""}]"", {""at"": ""2026-05-21T16:04:40.263856+00:00"", ""action"": ""trim"", ""reasoning"": ""Portfolio crisis with -11.26% alpha underperformance, minimal cash position (2.3%) limiting tactical deployment. Need to raise meaningful cash for portfolio optimization.""}]",9,5.95,EV/EBITDA multiple analysis with peer comparison,6.8,2026-04-09,active,,
7,,2026-03-12 14:02:49.997068+00,2026-05-07 14:02:22.541697+00,TBPH,LONG,Theravance Biopharma is a post-restructuring special situation trading at deep discount to net asset value. $329M cash+investments at Q3 2025 ($174M cash + $155M short-term investments) with 50.5M shares = $6.52/share in liquid assets alone vs $13.72 stock price. Company retains 35% stake in YUPELRI royalties + active pipeline (Izencitinib). Lazard hired for strategic review = sale or merger likely. Clark Street Value estimates $17.34 fair value = 26% upside. Special situation: cash/asset discount + M&A catalyst. Primary risk: pipeline burn rate and whether cash endures until deal closes.,HIGH,"""[{\""pillar\"": \""Pipeline optionality\"", \""detail\"": \""Izencitinib (gut-selective JAK inhibitor) in Phase IIb/III for ulcerative colitis/Crohn's. If successful = standalone acquisition target. $100M TRELEGY milestone expected Q1 2026.\""}]""","""[{\""catalyst\"": \""Strategic review announcement / acquisition offer\"", \""timeline\"": \""Q2 2026\""}, {\""catalyst\"": \""$100M TRELEGY milestone payment from Pfizer/Viatris\"", \""timeline\"": \""Q1 2026 - would push cash to $430M+\""}, {\""catalyst\"": \""Q4 2025 filing confirming cash position\"", \""timeline\"": \""March 2026 - imminent\""}, {\""catalyst\"": \""Q4 2025 filing in FMP confirming $400M+ cash position\"", \""timeline\"": \""Imminent - watching for FMP update\""}, {\""catalyst\"": \""Q4 2025 filing CONFIRMED with strong results - revenue $45.9M vs $20M prior, $53M other income (likely TRELEGY milestone), $20M operating income vs prior loss\"", \""timeline\"": \""CONFIRMED - March 19 2026\""}, {\""catalyst\"": \""Strategic review outcome - sale or merger with Lazard running the process\"", \""timeline\"": \""Q2-Q3 2026\""}, {\""catalyst\"": \""Strategic review (Lazard) outcome expected Q2-Q3 2026 - share buyback or M&A deal\"", \""timeline\"": \""Q2-Q3 2026\""}, {\""catalyst\"": \""Q1 2026 earnings May 14 - test of royalty run rate and cash burn trajectory\"", \""timeline\"": \""2026-05-14\""}, {\""catalyst\"": \""Q4 2025 confirmed March 23: $61M net income, $53M TRELEGY milestone received, cash now $400M+\"", \""timeline\"": \""CONFIRMED\""}, {\""catalyst\"": \""Q1 2026 earnings May 14 - test of royalty run rate post-milestone\"", \""timeline\"": \""2026-05-14\""}]""","""[{\""risk\"": \""Strategic review fails / no buyer found\"", \""impact\"": \""MAJOR - stock reverts to cash burn discount\""}, {\""risk\"": \""Pipeline burns through cash before deal\"", \""impact\"": \""MODERATE - Q3 burn rate ~$10M/quarter. At $329M = 30+ quarters of runway\""}, {\""risk\"": \""Izencitinib fails Phase IIb/III\"", \""impact\"": \""MODERATE - reduces acquisition attractiveness but YUPELRI royalty still valuable\""}, {\""risk\"": \""TRELEGY milestone delayed or reduced\"", \""impact\"": \""MODERATE - thesis partially dependent on this cash inflow\""}, {\""risk\"": \""Dilutive financing round\"", \""impact\"": \""LOW given $329M cash position\""}]""","[""[{\""date\"": \""2026-03-13T14:01:28.744554+00:00\"", \""data_point\"": \""Mar 13 deep analysis: TBPH at $13.91, essentially flat (+0.14%). CRITICAL: Q4 2025 filing not yet in FMP (latest is Q3 2025). Q3 data: $174M cash + $155M ST investments = $329M total. FMP shows Q3 revenue $20M (YUPELRI royalty base), operating loss -$6.5M, net income $3.6M (tax benefit). TTM from 3 quarters visible = burning ~$10-20M/quarter at operating level but royalty income and other income offsetting. Need Q4 2025 filing to verify (1) cash still intact, (2) TRELEGY $100M milestone received. At $13.91 with $329M cash ($6.52/share), stock is trading at 2.13x NAV \\u2014 modest premium for strategic review optionality. Earnings date confirmed May 13 (61 days = LOW RISK). WATCH for Q4 filing confirming cash thesis.\"", \""thesis_impact\"": \""CONFIRMS\"", \""action\"": \""MAINTAIN\"", \""conviction_change\"": null}, {\""date\"": \""2026-03-16T14:02:00.226528+00:00\"", \""data_point\"": \""Mar 16: TBPH at $13.96 (+1.31%). Mktcap $707M. Latest filing still Q3 2025. Q3: cash $174M + ST investments $155M = $329M total. BUT Substack (Clark Street via Yellowbrick) says $400M cash by Q1 2026 + $100M TRELEGY milestone = potentially $500M total. Q4 2025 not yet in FMP. FMP shows latest as Q3 Sep 2025. Revenue Q3: $20M (YUPELRI royalty stream). Operating loss Q3: -$6.5M. Net income Q3: $3.6M (tax benefit from NOLs). Stock at $13.96, target $17.34 = 24% upside. Q1 2026 filing (which would show cash) expected imminently. Earnings date May 13 (58 days).\"", \""thesis_impact\"": \""CONFIRMS\"", \""action\"": \""MAINTAIN\"", \""conviction_change\"": \""LOW\""}, {\""date\"": \""2026-03-17T14:01:02.907532+00:00\"", \""data_point\"": \""Mar 17: TBPH at $14.04, up +0.77%. Q4 2025 filing still not in FMP (latest still Q3 2025). Q3 cash $174M + ST investments $155M = $329M. Earnings date confirmed May 13. Mktcap now $711M vs $329M cash base. Note: operating losses still -$6.5M/quarter. TRELEGY milestone remains unconfirmed. Strategic review ongoing with Lazard. No new catalysts today but thesis intact.\"", \""thesis_impact\"": \""CONFIRMS\"", \""action\"": \""MAINTAIN\"", \""conviction_change\"": null}, {\""date\"": \""2026-03-17T16:02:08.875589+00:00\"", \""data_point\"": \""Mar 17: Q4 2025 filing STILL not in FMP (latest Q3). War Day 18 with Larijani + Basij commander killed. War deepening confirms strategic review urgency for TBPH as a potential acquisition target. Cash thesis ($329M confirmed Q3, $400M+ expected with TRELEGY milestone) unchanged. Price $14.04 stable. Lazard strategic review ongoing.\"", \""thesis_impact\"": \""CONFIRMS\"", \""action\"": \""MAINTAIN\"", \""conviction_change\"": null}, {\""date\"": \""2026-03-18T14:01:44.969034+00:00\"", \""data_point\"": \""Mar 18: TBPH at $13.815. Mktcap $700M. CRITICAL: Q4 2025 still NOT in FMP (latest is Q3 2025 filed Nov 12). This is now cycle 7+ without Q4 filing. Q3 data: cash $174M + ST investments $155M = $329M. BUT this is Q3 2025 data from Nov 2025. We're now in March 2026 - 4+ months later. Earnings date confirmed May 13, 56 days away = LOW risk. Clark Street thesis: $400M cash post TRELEGY $100M milestone. Still unconfirmed in FMP. FCF calculations impossible without Q4. Burn rate: ~$10M/quarter operating. If TRELEGY milestone received: $429M cash = $8.50/share in liquid assets at 50.5M shares. Stock at $13.82 = only $5.32 premium for pipeline, royalty, M&A optionality. Strategic review with Lazard = M&A catalyst timing Q2 2026. LOW conviction maintained until Q4 confirmed.\"", \""thesis_impact\"": \""NEUTRALIZES\"", \""action\"": \""MAINTAIN\"", \""conviction_change\"": null}, {\""date\"": \""2026-03-19T14:01:56.034567+00:00\"", \""data_point\"": \""TBPH Q4 2025 filing confirmed TODAY (Mar 19, 2026 - accepted 08:38 AM). Q4 data: Revenue $45.9M (up from $20M in Q3!), Operating Income $20M, Net Income $61M (massive tax benefit -$34.7M), Other Income $53.1M (TRELEGY milestone likely). Q4 filing shows massive cash inflow quarter. Market cap $705M at $13.92. Q4 operating income $20M vs Q3 -$6.5M = DRAMATIC improvement. The $100M TRELEGY milestone appears to have been received (other income $53M). Thesis core catalyst CONFIRMED.\"", \""thesis_impact\"": \""CONFIRMS\"", \""action\"": \""MAINTAIN\"", \""conviction_change\"": null}, {\""date\"": \""2026-03-19T14:03:49.463909+00:00\"", \""data_point\"": \""Q4 2025 filed today Mar 19 2026. Revenue $45.9M (Q3: $20M), Operating Income $20M (Q3: -$6.5M), Other Income $53.1M (TRELEGY milestone likely), Net Income $61M. Estimated cash now $400M+. The two key thesis pillars just confirmed simultaneously: (1) cash intact and growing, (2) TRELEGY milestone received Q4. Clark Street Value $17.34 target = 24.6% upside. Strategic review with Lazard ongoing - M&A catalyst still live. Upgrading conviction to MEDIUM. At $13.92, stock is $7.40 above liquid assets per share ($6.52 Q3 + additional Q4 inflows = likely $7.50-8/share now in liquid assets). Premium to NAV is modest for an imminent strategic review.\"", \""thesis_impact\"": \""CONFIRMS\"", \""action\"": \""INCREASE\"", \""conviction_change\"": \""MEDIUM\""}, {\""date\"": \""2026-03-20T14:01:51.776947+00:00\"", \""data_point\"": \""Mar 20 deep analysis: TBPH at $14.03 (+0.14%). Q4 filed yesterday (Mar 19): Revenue $45.9M, Op Income $20M, Other income $53.1M (TRELEGY milestone confirmed), Net income $61M. Mktcap $710.9M. Balance sheet: need to estimate Q4 cash. Q3 was $329M. Q4 added $61M net income, minimal burns expected. Cash likely $370-400M. At $710.9M mktcap with ~$380M cash = $330M market value for royalty stream + pipeline = still attractive. Strategic review ongoing with Lazard. No M&A announcement yet but thesis intact. LIMITED CASH (14.1%) prevents new entry. WATCH for M&A catalyst.\"", \""thesis_impact\"": \""CONFIRMS\"", \""action\"": \""MAINTAIN\"", \""conviction_change\"": null}, {\""date\"": \""2026-03-23T14:01:01.136822+00:00\"", \""data_point\"": \""Q4 2025 filed Mar 23 2026 (today). Revenue $45.9M, op income $20M, other income $53.1M (TRELEGY milestone), net income $61M. Current price $14.72 vs thesis target $17.34. Mktcap $745.9M. Earnings May 13 (51 days). Consensus Q1 2026 EPS -$0.03 (minimal burn). Strategic review with Lazard ongoing.\"", \""thesis_impact\"": \""CONFIRMS\"", \""action\"": \""MAINTAIN\"", \""conviction_change\"": \""MEDIUM\""}, {\""date\"": \""2026-03-24T14:01:12.174362+00:00\"", \""data_point\"": \""Q4 2025 filing confirmed Mar 23: Revenue $45.9M, operating income $20M, net income $61M including $53M TRELEGY milestone. Q4 cash/investment position update critical - need balance sheet. Filing now in FMP system. Earnings May 14 2026 (51 days, LOW RISK).\"", \""thesis_impact\"": \""CONFIRMS\"", \""action\"": \""MAINTAIN\"", \""conviction_change\"": \""MEDIUM\""}, {\""date\"": \""2026-03-25T08:01:31.612677+00:00\"", \""data_point\"": \""Mar 25 daily review: TBPH at $14.69 (FMP cached). Strategic review with Lazard active. Q4 confirmed: $380M+ cash, $53M TRELEGY milestone received. Cash constraint remains: $280.67 in portfolio cash (up massively from $71.70). If deploying new cash, TBPH is #1 priority watch. Mktcap ~$745M vs $380M+ cash = still attractive special situation. Target $17.34 = 18% upside.\"", \""thesis_impact\"": \""CONFIRMS\"", \""action\"": \""MAINTAIN\"", \""conviction_change\"": null}, {\""date\"": \""2026-03-25T14:00:42.401843+00:00\"", \""data_point\"": \""Mar 25 deep analysis: TBPH at $15.20 (+2.0% today). Mktcap now $770M. Q4 2025 confirmed: $45.9M revenue, $20M op income, $61M net income ($53M other income = TRELEGY milestone). Cash thesis strengthened. Next earnings May 14 (50 days, LOW RISK). Consensus EPS -$0.029 = market expects modest loss as royalty income normalizes. But strategic review (Lazard) remains the key catalyst. Cash position likely $380M+ post TRELEGY milestone. At $770M mktcap with $380M+ cash = 49.4% cash to mktcap. Still deeply discounted to NAV.\"", \""thesis_impact\"": \""CONFIRMS\"", \""action\"": \""MAINTAIN\"", \""conviction_change\"": null}, {\""date\"": \""2026-03-25T14:01:59.717450+00:00\"", \""data_point\"": \""ENTERED POSITION: 4 shares bought at $15.13 on Mar 25 2026. Trade ID 14. Commission $0.61. Cash deployed from new $208.97 account injection. This is the first deployment of new capital. Total position value $60.52.\"", \""thesis_impact\"": \""CONFIRMS\"", \""action\"": \""INCREASE\"", \""conviction_change\"": \""HIGH\""}, {\""date\"": \""2026-03-26T14:01:23.982575+00:00\"", \""data_point\"": \""Mar 26 deep analysis: TBPH at $15.38. Mktcap $785M. Q4 2025 CONFIRMED (filed Mar 23): Revenue $45.9M, Op income $17.6M, Total other income $53.1M (TRELEGY milestone), Net income $61M, EPS $1.20. Cash position likely now $400M+ after $53M TRELEGY payment. TTM revenue: Q1 $20M + Q2 $20M + Q3 $20M + Q4 $45.9M = ~$105.9M. Earnings May 14 (49 days, LOW RISK). Cash/mktcap = ~51%. Lazard process still running. Target $17.34 = 12.7% upside. M&A scenario $21-22 = 37-43% upside. Special situation with cash backstop.\"", \""thesis_impact\"": \""CONFIRMS\"", \""action\"": \""MAINTAIN\"", \""conviction_change\"": null}, {\""date\"": \""2026-03-27T14:01:23.625920+00:00\"", \""data_point\"": \""Mar 27 deep analysis: TBPH at $14.879 (-2.05% today). Market cap $766M. Q4 confirmed (Mar 23): Revenue $45.9M, net income $61M (includes $53M TRELEGY milestone), cash now $400M+. $400M cash / $766M mktcap = 52.2% cash-to-mktcap ratio. Strategic review (Lazard) ongoing. May 14 earnings = next catalyst. Consensus EPS -$0.06 (small loss expected = burn rate). The M&A process is the primary value unlock. Thesis: cash $400M + YUPELRI royalties + pipeline optionality (Izencitinib) = deeply discounted NAV. Fair value estimates $17.34-$20+ range.\"", \""thesis_impact\"": \""CONFIRMS\"", \""action\"": \""MAINTAIN\"", \""conviction_change\"": null}, {\""date\"": \""2026-03-30T14:02:52.889649+00:00\"", \""data_point\"": \""Mar 30 deep analysis: TBPH at $15.31, +$0.23 (+1.5%) today. Q4 2025 confirmed (filed Mar 23): Revenue $45.9M, Net income $61M (includes $62.7M other income = TRELEGY milestone received), Operating income $10.4M. Cash confirmed at $400M+ (based on $53M milestone + prior $329M base + Q4 operating cash flow). Earnings May 14 (45 days = LOW RISK). Lazard M&A process running. EPS estimate -$0.06 for Q1 = consensus expects operating losses as expected for pharma. Thesis intact.\"", \""thesis_impact\"": \""CONFIRMS\"", \""action\"": \""MAINTAIN\"", \""conviction_change\"": null}, {\""date\"": \""2026-03-31T08:00:44.164691+00:00\"", \""data_point\"": \""Mar 31 daily review: TBPH at $15.26, essentially flat from $15.28 avg cost. SKWD +3.8% day. Portfolio now at $998.27 = only -0.17% from inception. Alpha +7.5% vs SPY. Lazard M&A process running. May 14 earnings next catalyst. No new information on TBPH specifically.\"", \""thesis_impact\"": \""CONFIRMS\"", \""action\"": \""MAINTAIN\"", \""conviction_change\"": null}, {\""date\"": \""2026-03-31T14:01:35.344790+00:00\"", \""data_point\"": \""Mar 31 deep analysis: TBPH at $16.08 (up 5.4% today), +5.2% from $15.28 cost. Mktcap now $828M. Q4 2025 confirmed: revenue $45.9M, net income $61M (includes $53M TRELEGY milestone), cash inferred $400M+. At $828M mktcap vs $400M+ cash = 48% cash coverage. Lazard strategic review running. May 14 earnings next catalyst. STRONG day today (+5.4%) may reflect M&A speculation.\"", \""thesis_impact\"": \""CONFIRMS\"", \""action\"": \""MAINTAIN\"", \""conviction_change\"": null}, {\""date\"": \""2026-04-02T08:00:47.580043+00:00\"", \""data_point\"": \""Apr 2 daily review: TBPH at $15.84 (+3.66% from cost). Portfolio snapshot confirms 4 shares held. Unusual volume on Mar 31 (+4.06%) remains unresolved \\u2014 no M&A news confirmed yet. Lazard strategic review continues. May 14 earnings = next catalyst. War-uncorrelated special situation acting as portfolio ballast.\"", \""thesis_impact\"": \""CONFIRMS\"", \""action\"": \""MAINTAIN\"", \""conviction_change\"": null}, {\""date\"": \""2026-04-09T14:01:04.087350+00:00\"", \""data_point\"": \""Q4 2025 filing confirmed: $45.9M revenue (+130% QoQ), $20M operating income, $53.1M other income (TRELEGY milestone), $61M net income. Cash position now confirmed at $400M+, supporting $8/share NAV. Strategic review with Lazard still active for Q2-Q3 2026 outcome.\"", \""thesis_impact\"": \""CONFIRMS\"", \""action\"": \""MAINTAIN\"", \""conviction_change\"": \""HIGH\""}]"", {""at"": ""2026-05-07T14:02:22.541697+00:00"", ""action"": ""close"", ""reasoning"": ""TBPH has served its purpose as a special situation play, but the position size is too small to warrant continued attention. Capital should be redeployed to higher-conviction opportunities.""}]",17.34,12,NAV: $329M cash + YUPELRI royalty NPV ($150-200M est.) + pipeline optionality ($50-100M) = $530-630M / 50.5M shares = $10.50-$12.50 NAV. Upside scenario with M&A: 30% control premium on $12.50 = $16.25. Clark Street target $17.34. Current $13.72 = priced between NAV and M&A scenarios.,13.72,2026-03-12,closed,2026-05-07 14:02:22.541697+00,"close: TBPH has served its purpose as a special situation play, but the position size is too small to warrant continued attention. Capital should be redeployed to higher-conviction opportunities."
13,,2026-05-27 14:00:43.605001+00,2026-06-08 14:03:14.335328+00,SBLK,LONG,"SBLK is a dry bulk shipping company trading at a significant discount to its scrap value ($975M) versus gross debt ($951M). The company benefits from high operating leverage in the shipping cycle and serves essential global trade routes. With global trade normalization expected following potential Strait of Hormuz reopening, shipping demand should strengthen.",HIGH,"""[{\""pillar\"": \""Essential trade infrastructure\"", \""evidence\"": \""145-vessel fleet serving critical global commodity transport\""}, {\""name\"": \""Geopolitical Shipping Volatility\"", \""description\"": \""Tensions in Middle East creating shipping volatility and trade route uncertainty\"", \""last_updated\"": \""2026-06-02\""}, {\""name\"": \""Scrap Value Advantage\"", \""description\"": \""Fleet scrap value exceeding debt obligations providing downside protection\"", \""last_updated\"": \""2026-06-02\""}, {\""name\"": \""High Operating Leverage\"", \""description\"": \""Benefiting from operating leverage as shipping rates recover\"", \""last_updated\"": \""2026-06-02\""}]""","""[]""","""[{\""risk\"": \""Shipping cycle downturn\"", \""mitigation\"": \""Monitor Baltic Dry Index and global trade volumes\""}, {\""risk\"": \""Geopolitical trade disruption\"", \""mitigation\"": \""Track Strait of Hormuz reopening timeline and Middle East stability\""}, {\""name\"": \""Strait of Hormuz Blockade\"", \""description\"": \""Iran threatening complete blockade of this critical oil chokepoint, with current traffic at 36 ships/week vs 130/day pre-war\""}]""","[""[\""[{\\\""at\\\"": \\\""2026-05-29T14:03:10.799987+00:00\\\"", \\\""action\\\"": \\\""trim\\\"", \\\""reasoning\\\"": \\\""This is a concentration management trim, not a thesis invalidation. The fundamental thesis remains intact - SBLK continues to benefit from high operating leverage in the shipping cycle and essential global trade routes. We're reducing position size from 19.6% to ~16.5% to comply with risk management principles.\\\""}, {\\\""date\\\"": \\\""2026-06-02T14:01:20.198808+00:00\\\"", \\\""data_point\\\"": \\\""Current price $27.73 shows +1.6% unrealized PnL, fundamentals confirm geopolitical shipping volatility tailwinds\\\"", \\\""thesis_impact\\\"": \\\""CONFIRMS\\\"", \\\""action\\\"": \\\""MAINTAIN\\\"", \\\""conviction_change\\\"": null}]\"", {\""at\"": \""2026-06-02T14:03:09.672860+00:00\"", \""action\"": \""trim\"", \""reasoning\"": \""SBLK remains a core holding with strong fundamentals and thesis intact, but position size has grown to 17.5% of portfolio. Trimming 16.7% of the position reduces concentration risk while maintaining exposure to this high-conviction idea. This is risk management, not thesis invalidation.\""}, {\""date\"": \""2026-06-08T14:02:22.884707+00:00\"", \""data_point\"": \""Iran-US military escalation has intensified with Iran threatening complete Strait of Hormuz blockade and US strikes on Iranian radar sites. Shipping traffic has dropped to 36 ships/week from 130/day pre-war, making the original thesis of 'global trade normalization following Hormuz reopening' invalid.\"", \""thesis_impact\"": \""invalidated\"", \""action\"": \""EXIT\"", \""conviction_change\"": null}]"", {""at"": ""2026-06-08T14:03:14.335328+00:00"", ""action"": ""invalidate"", ""reasoning"": ""The original thesis assumed global trade normalization following Hormuz reopening, but Iran has escalated to threatening complete blockade and US-Iran military conflict has intensified to mutual missile strikes. With shipping traffic at 36 ships/week versus 130/day pre-war, the fundamental premise of the thesis is invalidated.""}]",45,20,Asset-based valuation (scrap value) and earnings multiple analysis,27.291,2026-05-27,invalidated,2026-06-08 14:03:14.335328+00,"invalidate: The original thesis assumed global trade normalization following Hormuz reopening, but Iran has escalated to threatening complete blockade and US-Iran military conflict has intensified to mutual missile strikes. With shipping traffic at 36 ships/week versus 130/day pre-war, the fundamental premise of the thesis is invalidated."
